{
  "Design": {
    "Purpose": "",
    "Description": "",
    "Resin": "",
    "3D printer": "",
    "Design file": "",
    "STL file": "",
    "Slicer": "",
    "Date": ""
  },
  "Header": {
    "Comment": "",
    "Schema version": "0.1",
    "Image directory": "slices"
  },
  "Default settings": {
    "Comment": "Settings used for each layer, if not overridden by layer specific settings.",
    "Light engine power setting": 100,
    "Layer exposure time (ms)": 400,
    "Layer thickness (um)": 3,
    "Number of duplications": 1,
    "Command chain": [
      "WAIT 1",
      "UP 1 SPEED 25 ACC 350",
      "DOWN 1 SPEED 25 ACC 350"
    ]
  },
  "Layers": [
    {
      "Images": [
        "out0000.png"
      ],
      "Layer exposure time (ms)": [
        20000
      ]
    },
    {
      "Images": [
        "out0001.png"
      ],
      "Layer exposure time (ms)": [
        10000
      ]
    },
    {
      "Images": [
        "out0002.png"
      ],
      "Layer exposure time (ms)": [
        5000
      ]
    },
    {
      "Images": [
        "out0003.png"
      ],
      "Layer exposure time (ms)": [
        1000
      ]
    },
    {
      "Images": [
        "out0004.png"
      ],
      "Layer exposure time (ms)": [
        500
      ]
    },
    {
      "Images": [
        "out0005.png"
      ]
    },
    {
      "Images": [
        "out0006.png"
      ]
    },
    {
      "Images": [
        "out0007.png"
      ]
    },
    {
      "Images": [
        "out0008.png"
      ]
    },
    {
      "Images": [
        "out0009.png"
      ]
    },
    {
      "Images": [
        "out0010.png"
      ]
    },
    {
      "Images": [
        "out0011.png"
      ]
    },
    {
      "Images": [
        "out0012.png"
      ]
    },
    {
      "Images": [
        "out0013.png"
      ]
    },
    {
      "Images": [
        "out0014.png"
      ]
    },
    {
      "Images": [
        "out0015.png"
      ]
    },
    {
      "Images": [
        "out0016.png"
      ]
    },
    {
      "Images": [
        "out0017.png"
      ]
    },
    {
      "Images": [
        "out0018.png"
      ]
    },
    {
      "Images": [
        "out0019.png"
      ]
    },
    {
      "Images": [
        "out0020.png"
      ]
    },
    {
      "Images": [
        "out0021.png"
      ]
    },
    {
      "Images": [
        "out0022.png"
      ]
    },
    {
      "Images": [
        "out0023.png"
      ]
    },
    {
      "Images": [
        "out0024.png"
      ]
    }
  ]
}